{
    "$schema": "http://json-schema.org/draft-07/schema#",
    "type": "array",
    "items": {
        "type": "object",
        "properties": {
            "name": { "type": "string" },

            "production": { "type": "number" },
            "food": { "type": "number" },
            "gold": { "type": "number" },
            "science": { "type": "number" },
            "culture": { "type": "number" },
            "happiness": { "type": "number" },
            "faith": { "type": "number" },

            "color": { "$ref": "https://raw.githubusercontent.com/yairm210/Unciv/master/docs/Modders/schemas/color.json" },

            "greatPersonPoints": {
                "type": "object",
                "additionalProperties": {
                    "type": "integer"
                }
            }
        },
        "required": ["name", "color"],
        "additionalProperties": false
    }
}
